{
  "schema_version": "1.0",
  "id": "trial-en",
  "language": "en-US",
  "format": "cta",
  "audience": "Independent tutors",
  "offer": {
    "name": "Turno",
    "facts": [
      "Free trial available."
    ]
  },
  "cta": {
    "action": "Starts the confirmed free trial",
    "accepted_phrases": [
      "Start free trial"
    ]
  },
  "constraints": {
    "item_count": 1,
    "max_characters_per_item": 18,
    "required_phrases": [],
    "forbidden_phrases": []
  },
  "sources": [
    {
      "id": "product",
      "reference": "Synthetic product brief for examples; not a real campaign."
    }
  ],
  "claims": [],
  "market": "US",
  "category": "general"
}
